{
  "schema_version": "1.0.0",
  "protocol_version": "1.0.0",
  "method": "chatbot_closed_registry_oa_search_v1",
  "updated": "2026-08-19",
  "default_mode": "registry_closed",
  "runtime_enforcement": false,
  "network_boundary": {
    "custom_server_required": false,
    "skill_required": false,
    "public_ocean_enabled": false,
    "arbitrary_url_fetch_enabled": false,
    "allowed_schemes": [
      "https"
    ],
    "redirect_policy": "same_host_only"
  },
  "modes": {
    "registry_closed": {
      "provider_must_be_registered": true,
      "target_must_be_registered": true,
      "provider_target_may_differ_only_when_adapter_declares_target_source_ids": true
    },
    "direct_only": {
      "provider_must_be_registered": true,
      "target_must_be_registered": true,
      "provider_must_equal_target": true
    }
  },
  "selection": {
    "target_source_count": 5,
    "maximum_source_count": 8,
    "source_status_required": "active",
    "adapter_status_required": "searchable",
    "semantic_match_fields": [
      "name",
      "subjects",
      "source_type",
      "access_roles",
      "oa_scope",
      "notes",
      "translation.zh-TW"
    ],
    "no_adapter_status": "NO_SEARCH_ADAPTER"
  },
  "terminal_statuses": [
    "SUCCESS",
    "NO_RESULTS",
    "NO_SEARCH_ADAPTER",
    "SOURCE_FETCH_GAP",
    "CLOSED_WORLD_VIOLATION"
  ],
  "gap_statuses": [
    "NO_SEARCH_ADAPTER",
    "SOURCE_FETCH_GAP",
    "REGISTRY_COVERAGE_GAP",
    "CLOSED_WORLD_VIOLATION"
  ],
  "trace_required_fields": [
    "registry_release_id",
    "routing_sha256",
    "mode",
    "adapter_id",
    "provider_source_id",
    "target_source_id",
    "request_url",
    "observed_url",
    "redirect_chain",
    "http_status",
    "content_type",
    "parser",
    "observed_at",
    "dedupe_key",
    "status"
  ],
  "adapters": [
    {
      "adapter_id": "europe-pmc-topic-search",
      "source_id": "europe-pmc",
      "status": "searchable",
      "capability": "topic_search",
      "method": "GET",
      "endpoint_template": "https://www.ebi.ac.uk/europepmc/webservices/rest/search?query=%28{query}%29%20AND%20OPEN_ACCESS%3AY&resultType=core&format=json&pageSize={limit}",
      "query_encoding": "url_component_utf8",
      "allowed_hosts": [
        "www.ebi.ac.uk"
      ],
      "redirect_policy": "same_host_only",
      "response_format": "json",
      "accepted_content_types": [
        "application/json"
      ],
      "parser": "europe_pmc_search_v6",
      "authentication": "none",
      "default_limit": 10,
      "maximum_limit": 100,
      "target_source_policy": "same_as_provider",
      "result_identity_fields": [
        "doi",
        "pmid",
        "pmcid",
        "id"
      ],
      "oa_result_rule": "server_query_requires_OPEN_ACCESS_Y_and_each_result_remains_record_level_evidence",
      "dedupe_key_order": [
        "doi",
        "pmcid",
        "pmid",
        "normalized_title_year"
      ],
      "verification": {
        "live_status": "verified",
        "checked": "2026-08-19",
        "observed_http_status": 200,
        "observed_content_type": "application/json;charset=UTF-8",
        "evidence_url": "https://europepmc.org/RestfulWebService"
      },
      "notes": "The OPEN_ACCESS:Y clause is part of the fixed template; the chatbot may substitute only the encoded topic and bounded limit."
    },
    {
      "adapter_id": "openalex-oa-topic-search",
      "source_id": "openalex",
      "status": "searchable",
      "capability": "topic_search",
      "method": "GET",
      "endpoint_template": "https://api.openalex.org/works?search={query}&filter=open_access.is_oa%3Atrue&select=id,doi,title,publication_year,open_access,primary_location&per-page={limit}",
      "query_encoding": "url_component_utf8",
      "allowed_hosts": [
        "api.openalex.org"
      ],
      "redirect_policy": "same_host_only",
      "response_format": "json",
      "accepted_content_types": [
        "application/json"
      ],
      "parser": "openalex_works_v1",
      "authentication": "none",
      "default_limit": 10,
      "maximum_limit": 100,
      "target_source_policy": "same_as_provider",
      "result_identity_fields": [
        "id",
        "doi"
      ],
      "oa_result_rule": "server_filter_requires_open_access_is_oa_true_but_fulltext_and_licence_claims_remain_record_level",
      "dedupe_key_order": [
        "doi",
        "id",
        "normalized_title_year"
      ],
      "verification": {
        "live_status": "verified",
        "checked": "2026-08-19",
        "observed_http_status": 200,
        "observed_content_type": "application/json",
        "evidence_url": "https://docs.openalex.org/api-entities/works/search-works"
      },
      "notes": "OpenAlex is a registered metadata discovery source. Do not fetch returned publisher or DOI URLs unless a separate registered adapter authorizes them."
    },
    {
      "adapter_id": "pubmed-central-topic-search",
      "source_id": "pubmed-central",
      "status": "searchable",
      "capability": "topic_search",
      "method": "GET",
      "endpoint_template": "https://eutils.ncbi.nlm.nih.gov/entrez/eutils/esearch.fcgi?db=pmc&term={query}&retmode=json&retmax={limit}",
      "query_encoding": "url_component_utf8",
      "allowed_hosts": [
        "eutils.ncbi.nlm.nih.gov"
      ],
      "redirect_policy": "same_host_only",
      "response_format": "json",
      "accepted_content_types": [
        "application/json"
      ],
      "parser": "ncbi_eutils_esearch_json_v1",
      "authentication": "none",
      "default_limit": 10,
      "maximum_limit": 100,
      "target_source_policy": "same_as_provider",
      "result_identity_fields": [
        "pmcid"
      ],
      "oa_result_rule": "database_is_pmc_but_version_and_reuse_licence_must_be_resolved_per_record",
      "dedupe_key_order": [
        "pmcid"
      ],
      "verification": {
        "live_status": "verified",
        "checked": "2026-08-19",
        "observed_http_status": 200,
        "observed_content_type": "application/json; charset=UTF-8",
        "evidence_url": "https://www.ncbi.nlm.nih.gov/books/NBK25499/"
      },
      "notes": "This route searches the PMC database only. Returned IDs do not by themselves prove a uniform reuse licence or publication version."
    },
    {
      "adapter_id": "doaj-article-topic-search",
      "source_id": "doaj",
      "status": "searchable",
      "capability": "topic_search",
      "method": "GET",
      "endpoint_template": "https://doaj.org/api/v4/search/articles/{query}?page=1&pageSize={limit}",
      "query_encoding": "url_path_segment_utf8",
      "allowed_hosts": [
        "doaj.org"
      ],
      "redirect_policy": "same_host_only",
      "response_format": "json",
      "accepted_content_types": [
        "application/json"
      ],
      "parser": "doaj_article_search_v4",
      "authentication": "none",
      "default_limit": 10,
      "maximum_limit": 100,
      "target_source_policy": "same_as_provider",
      "result_identity_fields": [
        "id",
        "bibjson.identifier"
      ],
      "oa_result_rule": "results_are_doaj_article_records_but_article_level_licence_and_fulltext_links_remain_record_level",
      "dedupe_key_order": [
        "doi",
        "id",
        "normalized_title_year"
      ],
      "verification": {
        "live_status": "verified",
        "checked": "2026-08-19",
        "observed_http_status": 200,
        "observed_content_type": "application/json",
        "evidence_url": "https://doaj.org/api/docs"
      },
      "notes": "The path placeholder must be encoded as one URL path segment. Result links are data until another registered adapter authorizes a fetch."
    },
    {
      "adapter_id": "zenodo-publication-topic-search",
      "source_id": "zenodo",
      "status": "searchable",
      "capability": "topic_search",
      "method": "GET",
      "endpoint_template": "https://zenodo.org/api/records?q={query}%20AND%20resource_type.type%3Apublication&size={limit}",
      "query_encoding": "url_component_utf8",
      "allowed_hosts": [
        "zenodo.org"
      ],
      "redirect_policy": "same_host_only",
      "response_format": "json",
      "accepted_content_types": [
        "application/json"
      ],
      "parser": "zenodo_records_v1",
      "authentication": "none",
      "default_limit": 10,
      "maximum_limit": 25,
      "target_source_policy": "same_as_provider",
      "result_identity_fields": [
        "id",
        "doi"
      ],
      "oa_result_rule": "server_query_limits_resource_type_to_publication_but_each_file_access_and_licence_remain_record_level",
      "dedupe_key_order": [
        "doi",
        "id",
        "normalized_title_year"
      ],
      "verification": {
        "live_status": "verified",
        "checked": "2026-08-19",
        "observed_http_status": 200,
        "observed_content_type": "application/json",
        "evidence_url": "https://developers.zenodo.org/"
      },
      "notes": "The fixed query suffix restricts results to publication records. Do not follow links to unregistered hosts."
    },
    {
      "adapter_id": "arxiv-topic-search",
      "source_id": "arxiv",
      "status": "searchable",
      "capability": "topic_search",
      "method": "GET",
      "endpoint_template": "https://export.arxiv.org/api/query?search_query=all%3A{query}&start=0&max_results={limit}",
      "query_encoding": "url_component_utf8",
      "allowed_hosts": [
        "export.arxiv.org"
      ],
      "redirect_policy": "same_host_only",
      "response_format": "atom",
      "accepted_content_types": [
        "application/atom+xml"
      ],
      "parser": "arxiv_atom_v1",
      "authentication": "none",
      "default_limit": 10,
      "maximum_limit": 100,
      "target_source_policy": "same_as_provider",
      "result_identity_fields": [
        "entry.id"
      ],